{
  "$schema": "https://json-schema.org/draft/2020-12/schema",
  "$id": "https://example.com/schemas/difficult.schema.json",
  "title": "Difficulties",
  "type": "object",
  "required": ["niveles"],
  "properties": {
    "niveles": { "type": "object" },
    "formulas_calculo": { "type": "object" },
    "indices_dificultad": { "type": "object" },
    "constantes_globales": { "type": "object" }
  },
  "additionalProperties": true
}
